{
  "bomFormat": "CycloneDX",
  "specVersion": "1.6",
  "serialNumber": "urn:uuid:fb29a278-4467-4116-a44e-882aba730599",
  "version": 1,
  "metadata": {
    "timestamp": "2026-09-28T20:05:10.823Z",
    "tools": {
      "components": [
        {
          "type": "application",
          "name": "npm-to-cyclonedx",
          "version": "1.0.0"
        }
      ]
    },
    "component": {
      "bom-ref": "pkg:npm/novafact-api@3.7.0",
      "type": "application",
      "name": "novafact-api",
      "version": "3.7.0",
      "purl": "pkg:npm/novafact-api@3.7.0"
    }
  },
  "components": [
    {
      "bom-ref": "pkg:npm/%40novafact/telemetry@0.4.3",
      "type": "library",
      "group": "@novafact",
      "name": "telemetry",
      "version": "0.4.3",
      "purl": "pkg:npm/%40novafact/telemetry@0.4.3",
      "scope": "required"
    },
    {
      "bom-ref": "pkg:npm/%40novafact/ui-kit@1.2.0",
      "type": "library",
      "group": "@novafact",
      "name": "ui-kit",
      "version": "1.2.0",
      "purl": "pkg:npm/%40novafact/ui-kit@1.2.0",
      "scope": "required"
    },
    {
      "bom-ref": "pkg:npm/ajv@8.20.0",
      "type": "library",
      "name": "ajv",
      "version": "8.20.0",
      "purl": "pkg:npm/ajv@8.20.0",
      "scope": "required"
    },
    {
      "bom-ref": "pkg:npm/argparse@2.0.1",
      "type": "library",
      "name": "argparse",
      "version": "2.0.1",
      "purl": "pkg:npm/argparse@2.0.1",
      "scope": "required"
    },
    {
      "bom-ref": "pkg:npm/body-parser@1.20.3",
      "type": "library",
      "name": "body-parser",
      "version": "1.20.3",
      "purl": "pkg:npm/body-parser@1.20.3",
      "scope": "required"
    },
    {
      "bom-ref": "pkg:npm/cookie@0.7.1",
      "type": "library",
      "name": "cookie",
      "version": "0.7.1",
      "purl": "pkg:npm/cookie@0.7.1",
      "scope": "required"
    },
    {
      "bom-ref": "pkg:npm/express@4.21.2",
      "type": "library",
      "name": "express",
      "version": "4.21.2",
      "purl": "pkg:npm/express@4.21.2",
      "scope": "required"
    },
    {
      "bom-ref": "pkg:npm/fast-deep-equal@3.1.3",
      "type": "library",
      "name": "fast-deep-equal",
      "version": "3.1.3",
      "purl": "pkg:npm/fast-deep-equal@3.1.3",
      "scope": "required"
    },
    {
      "bom-ref": "pkg:npm/js-yaml@4.1.0",
      "type": "library",
      "name": "js-yaml",
      "version": "4.1.0",
      "purl": "pkg:npm/js-yaml@4.1.0",
      "scope": "required"
    },
    {
      "bom-ref": "pkg:npm/node-fetch@3.3.2",
      "type": "library",
      "name": "node-fetch",
      "version": "3.3.2",
      "purl": "pkg:npm/node-fetch@3.3.2",
      "scope": "required"
    },
    {
      "bom-ref": "pkg:npm/pino@9.5.0",
      "type": "library",
      "name": "pino",
      "version": "9.5.0",
      "purl": "pkg:npm/pino@9.5.0",
      "scope": "required"
    },
    {
      "bom-ref": "pkg:npm/sonic-boom@4.2.0",
      "type": "library",
      "name": "sonic-boom",
      "version": "4.2.0",
      "purl": "pkg:npm/sonic-boom@4.2.0",
      "scope": "required"
    }
  ]
}
